{
  "campaign": "Test Webinar Script Type",
  "campaignType": "marketing",
  "description": "Test webinar-script deliverable type",
  "deliverables": [
    {
      "id": "TEST-WEBINAR",
      "type": "webinar-script",
      "title": "Product demo webinar",
      "description": "Script for 30-minute product webinar with Q&A",
      "acceptanceCriteria": [
        "Word count: 800-1200",
        "Clear structure: intro, main content sections, Q&A, outro",
        "Speaker notes included",
        "Time markers for 30-min format",
        "Passes brand compliance",
        "Readability score > 60"
      ],
      "priority": 1,
      "approved": true,
      "targetKeyword": null,
      "dependencies": []
    }
  ]
}
