{
  "campaign": "Test Case Study Type",
  "campaignType": "marketing",
  "description": "Test case-study deliverable type",
  "deliverables": [
    {
      "id": "TEST-CASE",
      "type": "case-study",
      "title": "Customer success story",
      "description": "Case study about customer using product to solve problem",
      "acceptanceCriteria": [
        "Word count: 600-800",
        "Structure: Problem, Solution, Results",
        "Includes customer quotes",
        "Specific metrics/results",
        "Passes brand compliance",
        "Readability score > 60"
      ],
      "priority": 1,
      "approved": true,
      "targetKeyword": null,
      "dependencies": []
    }
  ]
}
