{
  "campaign": "Test Media Pitch Type",
  "campaignType": "pr",
  "description": "Test media-pitch deliverable type",
  "deliverables": [
    {
      "id": "TEST-PITCH",
      "type": "media-pitch",
      "title": "Product launch pitch to tech journalists",
      "description": "Email pitch to tech journalists about new product launch",
      "acceptanceCriteria": [
        "Word count: 150-250",
        "Strong subject line",
        "Newsworthy hook in first paragraph",
        "Key details (who, what, when, why)",
        "Clear call to action",
        "Passes brand compliance",
        "Readability score > 60"
      ],
      "priority": 1,
      "approved": true,
      "targetKeyword": null,
      "dependencies": []
    }
  ]
}
