{
  "campaign": "Test Landing Page Type",
  "campaignType": "marketing",
  "description": "Test landing-page-copy deliverable type",
  "deliverables": [
    {
      "id": "TEST-LANDING",
      "type": "landing-page-copy",
      "title": "Product landing page",
      "description": "Landing page for analytics dashboard product",
      "acceptanceCriteria": [
        "Hero section with headline",
        "2 feature sections",
        "CTA included",
        "Passes brand compliance",
        "SEO optimized for keyword",
        "Readability score > 60"
      ],
      "priority": 1,
      "approved": true,
      "targetKeyword": "analytics dashboard",
      "dependencies": []
    }
  ]
}
