{
  "campaign": "Marketing Deliverable Types Test",
  "campaignType": "marketing",
  "description": "Test all 8 marketing deliverable types to verify core installation",
  "deliverables": [
    {
      "id": "MKT-EMAIL",
      "type": "email-sequence",
      "title": "Test email sequence",
      "description": "Simple 2-email welcome sequence for new product users",
      "acceptanceCriteria": [
        "2 emails created",
        "Each email < 300 words",
        "Subject lines included",
        "Passes brand compliance",
        "Readability score > 60"
      ],
      "priority": 1,
      "approved": false,
      "targetKeyword": null,
      "dependencies": []
    },
    {
      "id": "MKT-LANDING",
      "type": "landing-page-copy",
      "title": "Test landing page",
      "description": "Simple product landing page with hero and features",
      "acceptanceCriteria": [
        "Hero section with headline",
        "2 feature sections",
        "CTA included",
        "Passes brand compliance",
        "SEO optimized for keyword",
        "Readability score > 60"
      ],
      "priority": 2,
      "approved": false,
      "targetKeyword": "test product",
      "dependencies": []
    },
    {
      "id": "MKT-SOCIAL",
      "type": "social-posts",
      "title": "Test social posts",
      "description": "2 LinkedIn posts for product launch",
      "acceptanceCriteria": [
        "2 posts created",
        "Each post 200-400 characters",
        "Hashtags included",
        "Passes brand compliance",
        "Readability score > 60"
      ],
      "priority": 3,
      "approved": false,
      "targetKeyword": null,
      "dependencies": []
    },
    {
      "id": "MKT-AD",
      "type": "ad-copy",
      "title": "Test ad copy",
      "description": "Google search ad for product",
      "acceptanceCriteria": [
        "Headline < 30 characters",
        "Description < 90 characters",
        "CTA included",
        "Passes brand compliance",
        "Readability score > 60"
      ],
      "priority": 4,
      "approved": false,
      "targetKeyword": "test product",
      "dependencies": []
    },
    {
      "id": "MKT-BLOG",
      "type": "blog-article",
      "title": "Test blog article",
      "description": "Educational blog post about product benefits",
      "acceptanceCriteria": [
        "Word count: 500-700",
        "Has H2 and H3 headers",
        "Intro and conclusion sections",
        "Passes brand compliance",
        "SEO optimized",
        "Readability score > 60"
      ],
      "priority": 5,
      "approved": false,
      "targetKeyword": "product benefits",
      "dependencies": []
    },
    {
      "id": "MKT-NEWSLETTER",
      "type": "newsletter",
      "title": "Test newsletter",
      "description": "Monthly company newsletter with product update",
      "acceptanceCriteria": [
        "Word count: 300-500",
        "2-3 sections with headers",
        "CTA included",
        "Passes brand compliance",
        "Readability score > 60"
      ],
      "priority": 6,
      "approved": false,
      "targetKeyword": null,
      "dependencies": []
    },
    {
      "id": "MKT-CASE",
      "type": "case-study",
      "title": "Test case study",
      "description": "Customer success story with metrics",
      "acceptanceCriteria": [
        "Word count: 400-600",
        "Challenge/solution/results structure",
        "Specific metrics included",
        "Passes brand compliance",
        "Readability score > 60"
      ],
      "priority": 7,
      "approved": false,
      "targetKeyword": null,
      "dependencies": []
    },
    {
      "id": "MKT-WEBINAR",
      "type": "webinar-script",
      "title": "Test webinar script",
      "description": "Outline for product demo webinar",
      "acceptanceCriteria": [
        "Word count: 300-500",
        "Has intro/body/conclusion structure",
        "Key talking points listed",
        "Passes brand compliance",
        "Readability score > 60"
      ],
      "priority": 8,
      "approved": false,
      "targetKeyword": null,
      "dependencies": []
    }
  ]
}
