{
  "campaign": "Test Brand Positioning Type",
  "campaignType": "branding",
  "description": "Test brand-positioning deliverable type",
  "deliverables": [
    {
      "id": "TEST-POSITION",
      "type": "brand-positioning",
      "title": "Company brand positioning statement",
      "description": "Brand positioning document defining target audience, competitive landscape, unique value",
      "acceptanceCriteria": [
        "Word count: 400-600",
        "Target audience defined",
        "Competitive positioning clear",
        "Unique value proposition",
        "Reason to believe",
        "Brand promise stated",
        "Passes brand compliance",
        "Readability score > 60"
      ],
      "priority": 1,
      "approved": true,
      "targetKeyword": null,
      "dependencies": []
    }
  ]
}
