{
  "campaign": "Test Blog Article Type",
  "campaignType": "marketing",
  "description": "Test blog-article deliverable type",
  "deliverables": [
    {
      "id": "TEST-BLOG",
      "type": "blog-article",
      "title": "Educational blog post",
      "description": "Blog post about data analytics benefits",
      "acceptanceCriteria": [
        "Word count: 500-700",
        "Has H2 and H3 headers",
        "Intro and conclusion sections",
        "Passes brand compliance",
        "SEO optimized",
        "Readability score > 60"
      ],
      "priority": 1,
      "approved": true,
      "targetKeyword": "data analytics benefits",
      "dependencies": []
    }
  ]
}
