{
  "campaign": "Test Ad Copy Type",
  "campaignType": "marketing",
  "description": "Test ad-copy deliverable type",
  "deliverables": [
    {
      "id": "TEST-AD",
      "type": "ad-copy",
      "title": "Google search ad",
      "description": "Google search ad for analytics product",
      "acceptanceCriteria": [
        "Headline < 30 characters",
        "Description < 90 characters",
        "CTA included",
        "Passes brand compliance",
        "Readability score > 60"
      ],
      "priority": 1,
      "approved": true,
      "targetKeyword": "analytics tool",
      "dependencies": []
    }
  ]
}
